key,zh,en,th
请填写前端路由,请填写前端路由,,โปรดกรอก front-end routing
请填写名称,请填写名称,,กรุณากรอกชื่อ!
请填写权限名称,请填写权限名称,,กรุณากรอกชื่อการอนุญาต!
请选择商户,请选择商户,,กรุณาเลือกผู้ให้บริการ!
交易订单号,交易订单号,,หมายเลขคำสั่งซื้อ
货币,货币,,สกุลเงิน
投注金额,投注金额,,ยอดเงินเดิมพัน
玩家输赢金额,玩家输赢金额,,ยอดชนะและยอดเสียของผู้เล่น
玩家余额,玩家余额,,ยอดคงเหลือผู้เล่น
新玩家数量,新玩家数量,,จำนวนผู้เล่นใหม่
投注次数,投注次数,,จำนวนครั้งที่เดิมพัน
回合次数,回合次数,,จำนวนรอบ
总赢得金额,总赢得金额,,ยอดเงินที่ชนะทั้งหมด
玩家输赢,玩家输赢,,ผู้เล่นแพ้ชนะ
玩家输赢占比,玩家输赢占比,,อัตราส่วนชนะ/แพ้ของผู้เล่น
公司输赢,公司输赢,,บริษัทแพ้ชนะ
公司输赢占比,公司输赢占比,,อัตราส่วนชนะ/สูญเสียบริษัท
投注月份,投注月份,,เดิมพันต่อเดือน
增幅,增幅,,เพิ่มขึ้น
轻度,轻度,,น้อยลง
中度,中度,,ปานกลาง
重度,重度,,รุนแรง
简单,简单,,เรียบง่าย
一般,一般,,ทั่วไป
困难,困难,,ยาก
本周DAU,本周DAU,,DAU สัปดาห์นี้
上周DAU,上周DAU,,DAU สัปดาห์ก่อน
本周总押分,本周总押分,,ยอดรวมเดิมพันสัปดาห์นี้
上周总押分,上周总押分,,ยอดรวมเดิมพันสัปดาห์ก่อน
本周系统收益,本周系统收益,,รายได้ของระบบสัปดาห์นี้
上周系统收益,上周系统收益,,รายได้ของระบบสัปดาห์ก่อน
本周购买小游戏总押注,本周购买小游戏总押注,,เดิมพันรวมการซื้อมินิเกมสัปดาห์นี้
上周购买小游戏总押注,上周购买小游戏总押注,,เดิมพันรวมการซื้อมินิเกมสัปดาห์ก่อน
本周回报率,本周回报率,,ผลตอบแทนสัปดาห์นี้
上周回报率,上周回报率,,ผลตอบแทนสัปดาห์ก่อน
本周购买小游戏回报率,本周购买小游戏回报率,,ผลตอบแทนการซื้อมินิเกมในสัปดาห์นี้
上周购买小游戏回报率,上周购买小游戏回报率,,ผลตอบแทนการซื้อมินิเกมในสัปดาห์ก่อน
序号,序号,,ลำดับ
拉霸游戏,拉霸游戏,,เกมสล็อต
百人游戏,百人游戏,,เกมคาสิโนสด
